,API Name,API URL,API Category,API Date,API Description
36,Google Translate,/api/google-translate,Translation,08.20.2007,"The Google Translate API is now in its second version. As part of Google's larger Cloud Machine Learning API family, the Translate API can translate text between thousands of language pairs. The Cloud Translation API lets developers programmatically integrate the service with third party sites and applications."
37,Google Calendar,/api/google-calendar,Calendars,04.20.2006,"The Calendar Data API lets users perform most of the operations a normal Google Calendar user can on the Google Calendar website. Google Calendar allows client applications to view and update calendar events in the form of Google data API, GData, feeds. The Calendar Data API lets users incorporate Calendar functionality into their own application or website. Users can edit calendars, create and delete events, query for events that match particular criteria, send invitations, and more.

There are many possible uses for the Calendar data API. For example, users can create a web front end for a group calendar that uses Google Calendar as a back end. Or a public calendar can be generated for Google Calendar to display, based on a company event database. Or users can search relevant calendars to display a list of upcoming events on those calendars."
38,Google AdWords,/api/google-adwords,Advertising,01.22.2006,"The Google AdWords API allows apps to interact directly with the Google Ads platform, vastly increasing the efficiency of managing large or complex Google Ads accounts and campaigns. Some typical use cases include:

Automated account management
Custom reporting
Ad management based on inventory
Bid management based on business data

With the AdWords API you can build software that manages accounts from the customer level down to the keyword level. The API can do almost everything the Google Ads UI does, but programmatically.

The types of companies that have benefited from the AdWords API include:

Ad agencies
Search Engine Marketing (SEM) companies
Big brands managing a large number of accounts, with needs beyond what's possible within the Google Ads UI.

The API relies on SOAP and WSDL technologies to offer its services. You set up API access by obtaining a few required authentication credentials, creating some test accounts, and adding the authentication and account details to a configuration file for your client library. Authentication is via OAuth2.

To help you get started, they offer client libraries in Java, .NET, Python, PHP, Perl, and Ruby."
39,Commission Junction,/api/commission-junction,eCommerce,09.23.2006,"The Commission Detail Service is a REST-based API that enables advertisers and publishers to access real-time commission and item-detail data. Advertisers and publishers that wish to receive commission reporting updates in near real-time or to request new commission data on a regular basis can use this API to create in-house tools that access real-time commission data from the CJ network. Developers may search by any number of criteria including price, currency, country, serviceable area and UPC. A SOAP API is also available but will eventually be deprecated."
40,geocoder,/api/geocoder,Mapping,02.15.2006,"Geocoder.us is a public service providing free geocoding of addresses and intersections in the United States. Using the service you can find the latitude & longitude of any US address and much more. Geocoder.us offers four different ways to access our web services: an XML-RPC interface, a SOAP interface, a REST interface that returns an RDF/XML document, and a REST interface that returns a plain text comma separated values result. The methods and return values are equivalent across all three interfaces."
41,PayPal,/api/paypal,Payments,09.04.2005,"PayPal offers online payment solutions and has more than 153 million customers worldwide. The PayPal API makes powerful functionality available to developers by exposing various features of the PayPal platform. Functionality includes but is not limited to invoice management, transaction processing and account management."
42,MusicBrainz,/api/musicbrainz,Music,07.16.2006,"The MusicBrainz database contains a huge amount of music metadata, which is maintained by the MusicBrainz community. Find information about artists, albums, tracks and labels. Mash the data with your web app, media player, CD ripper, tagger or other applications requiring music metadata. The service's architecture follows the REST design principles. Interaction with the web service is done using HTTP and all content is served in a simple but flexible XML format."
43,Concur,/api/concur,Enterprise,03.02.2012,"The service provides online tools for business organizations to manage travel and expense reporting and reimbursement. Integrated travel booking functions combine with expense reporting within a single platform. The API allows integration with applications of customer companies, partner service providers, or independent third-party developers including mobile app developers.

API methods support submission and tracking of travel requests and booking of transportation and lodging, either for individuals or for groups completing the same travel. Methods also support creating, updating, and submitting expense reports as part of a reimbursement process."
44,Bit.ly,/api/bitly,URL Shortener,07.13.2008,"bit.ly allows users to shorten, share, and track links (URLs). Reducing the URL length makes sharing easier. bit.ly  can be accessed through their website, bookmarklets and this open API. bit.ly is also integrated into several popular third-party tools such as Tweetdeck and is used extensively on services like Twitter. Unique user-level and aggregate links can be created and let users view complete, real-time traffic and referrer data, as well as location and metadata."
45,Google Custom Search,/api/google-custom-search,Search,07.08.2007,"The Google Custom Search Engine API is a RESTful API that allows developer to get web or image search results data in JSON or Atom format. With the API, developers can add web search and/or site search capabilities to their website, blog or collection of websites."
46,Google Picasa,/api/google-picasa,Photos,03.23.2007,"Per provider, this API will be deprecated in January 2019. Developers are encouraged to migrate to the Google Photos Library API


From their site: The Picasa Web Albums data API allows client applications to view and update Picasa Web Albums content in the form of Google data API GData feeds. Your client application can request a list of user albums, photos, comments, or tags, edit or delete content in an existing entry, and query the content in an existing entry."
47,Blogger,/api/blogger,Blogging,02.08.2006,"The Blogger Data API allows client applications to view and update Blogger content in the form of Google Data API feeds. Your client application can use the Data API to create new blog posts, edit or delete existing posts, and query for posts that match particular criteria."
48,Google Geocoding,/api/google-geocoding,Mapping,12.08.2010,"The Google Geocoding API is a webservice for the Google Maps API. The Geocoding API provides a direct way to access a geocoder via an HTTP request, though it must be used in conjunction with Google Maps. Additionally, the service allows you to perform the converse operation (turning coordinates into addresses); this process is known as ""reverse geocoding."" Also, you can choose to limit your search to certain bounded areas (Viewport Biasing) or regions (Region Biasing)."
49,Microsoft Bing,/api/microsoft-bing,Search,01.23.2006,"Bing API enables developers to embed a flexible and powerful search engine as a custom search component in their sites and applications. Bing API offers open, flexible options for building or enhancing your site or applications. With the API users can search for web content, images, stories and more. Users can also monetize their applications with advertisements. It uses a RESTful protocol with results formatted either in XML or JSON and also provides support for SOAP protocol."
