,API Name,API URL,API Category,API Date,API Description
0,Google Maps,/api/google-maps,Mapping,12.05.2005,"[This API is no longer available. Google Maps' services have been split into multiple APIs, including the Static Maps API, Street View Image API, Directions APIs, Distance Matrix API, Elevation API, Geocoding API, Geolocation API, Places API, Roads API, and Time Zone API.

This page is maintained purely for historical and research purposes.]

The Google Maps API allow for the embedding of Google Maps onto web pages of outside developers, using a simple JavaScript interface or a Flash interface. It is designed to work on both mobile devices as well as traditional desktop browser applications. The API includes language localization for over 50 languages, region localization and geocoding, and has mechanisms for enterprise developers who want to utilize the Google Maps API within an intranet. The API HTTP services can be accessed over a secure (HTTPS) connection by Google Maps API Premier customers."
1,Twitter,/api/twitter,Social,12.08.2006,"[This API is no longer available. It has been split into multiple APIs, including the Twitter Ads API, Twitter Search Tweets API, and Twitter Direct Message API.

This profile is maintained for historical, research, and reference purposes only.]


The Twitter micro-blogging service includes two RESTful APIs. The Twitter REST API methods allow developers to access core Twitter data. This includes update timelines, status data, and user information. The Search API methods give developers methods to interact with Twitter Search and trends data. The API presently supports the following data formats: XML, JSON, and the RSS and Atom syndication formats, with some methods only accepting a subset of these formats."
2,YouTube,/api/youtube,Video,02.08.2006,"The Data API allows users to integrate their program with YouTube and allow it to perform many of the operations available on the website. It provides the capability to search for videos, retrieve standard feeds, and see related content. A program can also authenticate as a user to upload videos, modify user playlists, and more.

This integration can be used for a variety of uses such as developing a web application allowing users to upload video to YouTube, or a device or desktop application that brings the YouTube experience to a new platform. The Data API gives users programmatic access to the video and user information stored on YouTube. This can be used to personalize a web site or application with the user's existing information as well as perform actions like commenting on and rating videos. This RESTful API provides responses in XML format."
3,Flickr,/api/flickr,Photos,09.04.2005,"The Flickr API can be used to retrieve photos from the Flickr photo sharing service using a variety of feeds - public photos and videos, favorites, friends, group pools, discussions, and more. The API can also be used to upload photos and video.The Flickr API supports many protocols including REST, SOAP, XML-RPC. Responses can be formatted in XML, XML-RPC, JSON and PHP. Documentation is included for 14 API Kit libraries."
4,Facebook,/api/facebook,Social,08.16.2006,"[This API is no longer available. Its functions have been split among the following APIs: Facebook Ads, Facebook Atlas, Facebook Graph, and Facebook Marketing. This profile is being maintained purely for historical and research purposes.]

The Facebook API is a platform for building applications that are available to the members of the social network of Facebook. The API allows applications to use the social connections and profile information to make applications more involving, and to publish activities to the news feed and profile pages of Facebook, subject to individual users privacy settings. With the API, users can add social context to their applications by utilizing profile, friend, Page, group, photo, and event data. The API uses RESTful protocol and responses are in JSON format."
5,Amazon Product Advertising,/api/amazon-product-advertising,eCommerce,12.02.2005,"What was formerly the ECS - eCommerce Service - has been renamed the Product Advertising API. Through this API developers can retrieve product information. The API exposes Amazon's product data and e-commerce functionality. This allows developers, web site publishers and others to leverage the Amazon Product Discovery features that Amazon uses to power its own business, and potentially make money as an Amazon affiliate. Additionally, the API has features allowing developers to advertise proucts, let users search for Amazon products and help users discover Amazon products. Both REST and SOAP APIs are provided, this profile is for the REST API."
6,Twilio,/api/twilio,Telephony,01.09.2009,"Twilio provides a simple hosted API and markup language for businesses to quickly build scalable, reliable and advanced voice and SMS communications applications. Twilio provides a telephony infrastructure web service ""in the cloud"", enabling web programmers to integrate real-time phone calls into their applications. Twilio's simple Pay-As-You-Go pricing model means customers pay for capacity only when they need it, not before. Voice applications written on Twilio's cloud solution scale transparently, eliminating programming, operational and contractual headaches frequently associated with rapid growth or traffic spikes. 

Twilio provides a cloud API for voice and SMS communications that leverages existing web development skills, resources and infrastructure. It minimizes the learning curve required to build advanced, reliable voice communications applications that solve critical business needs. The syntax and programming model are focused on making application development as close to the request/response model of web application development as possible. The API uses a RESTful interface and responses are formatted in HTML, JSON, XML or CSV."
7,Last.fm,/api/lastfm,Music,10.30.2005,"The Last.fm API gives users the ability to build programs using Last.fm data, whether on the web, the desktop or mobile devices. The RESTful API allows for read and write access to the full slate of last.fm music data resources - albums, artists, playlists, events, users, and more. It allows users to call methods that respond in either XML or JSON."
8,Twilio SMS,/api/twilio-sms,Messaging,02.19.2010,"Twilio provides a simple hosted API and markup language for businesses to quickly build scalable, reliable and advanced voice and SMS communications applications. Twilio provides a telephony infrastructure web service ""in the cloud"", enabling web programmers to integrate real-time phone calls into their applications. Twilio's simple Pay-As-You-Go pricing model means customers pay for capacity only when they need it, not before. Voice applications written on Twilio's cloud solution scale transparently, eliminating programming, operational and contractual headaches frequently associated with rapid growth or traffic spikes. 

The SMS API allows users to send and receive SMS messages from their applications. The API can implement short code technology to allow both faster and higher volume sms messaging. Example uses of the API include sending customers automatic SMS messages, multi-factor authentication and interactive polling. The API uses a RESTful interface."
9,Microsoft Bing Maps,/api/microsoft-bing-maps,Mapping,12.02.2005,"Bing Maps API and Interactive SDK features an AJAX Map Control. Use BM to build maps which can include routes and traffic info. Gives developers the ability to code the controls, shapes, and layers of the maps, and can summon the birds-eye, 3D, and aerial imagery. For commercial applications Bing Maps Web Services is a set of programmable SOAP services that allow users to integrate maps and imagery, driving directions, and other location features into a Web application."
10,del.icio.us,/api/delicious-0,Bookmarks,10.30.2005,"From their site: del.icio.us is a social bookmarking website -- the primary use of del.icio.us is to store your bookmarks online, which allows you to access the same bookmarks from any computer and add bookmarks from anywhere, too. On del.icio.us, you can use tags to organize and remember your bookmarks, which is a much more flexible system than folders. 

The API provides read/write access to Delicious bookmarks and tags via an HTTP-based interface. The RESTful API returns responses in XML."
11,Google App Engine,/api/google-app-engine,Tools,12.05.2008,"[This API is no longer available. Its functions have been split among the following APIs: Google App Engine Admin, Google App Engine Task Queue, Google Cloud App Engine Tasks, Google App Engine Admin RPC. This profile is being maintained purely for historical and research purposes.] 
Use the Google App Engine platform to run web apps on Google's infrastructure, the same scalable systems that run Google applications. Use the platform to run your apps reliably, even if you have heavy load and data needs. The environment has dynamic web serving, persistent storage with queries, sorting and transactions, automatic scaling and load balancing, APIs for authenticating users and sending email using Google Accounts, and a local testing environment."
12,Foursquare,/api/foursquare,Social,09.10.2009,"The Foursquare API provides location based experiences with diverse information about venues, users, photos, and check-ins. The API supports real time access to places, Snap-to-Place that assigns users to specific locations, and Geo-tag. Additionally, Foursquare allows developers to build audience segments for analysis and measurement. JSON is the preferred response format."
13,Google Homepage,/api/google-homepage,Widgets,12.14.2005,"From their site: The Google Gadgets API provides a way to put third-party content onto the Google homepage. The main use of the Google Gadgets API is to create gadgets (mini-applications) that users can add to their Google personalized homepages and other Google properties. For example, you could create a photo album gadget, or a gadget that displays an interactive game. The API is designed to be simple enough so that anyone can turn his or her web page or application into a gadget."
14,DocuSign Enterprise,/api/docusign-enterprise,Electronic Signature,03.29.2008,"DocuSign is a Cloud based legally compliant eSignature service.  DocuSign service provides an intuitive web, mobile and an API interfaces.  DocuSign API allows an application to connect DocuSign service or embed parts of DocuSign user experience.  

By connecting to DocuSign web services applications can create electronic signature transactions, retrieve electronically signed documents, get up to date status on outstanding envelopes and do other Create/Read/Update/Delete operations.

By embedding DocuSign interface applications can provide single-sign-on capability and insert signing or sending user experience into their applications."
15,Amazon S3,/api/amazon-s3,Storage,03.14.2006,"Since 2006 Amazon Web Services has been offering web services commonly known as cloud computing. AWS Provides a reliable, low cost infrastructure platform that powers hundreds of thousands of businesses.

Amazon S3 API, the Simple Storage Service provides a simple web services interface used to store objects using the Amazon online storage infrastructure. Users can then download the data or use the data with other AWS services, such as Amazon Elastic Cloud Computer (EC2). Using this web service, developers can build applications that make use of Internet storage. 

The API uses Buckets, Objects, Keys and Operations. An object has four parts: value, key, metadata, and an access control policy. Objects are stored in buckets. The API is REST based. Responses are formatted in JSON."
16,Google AdSense,/api/google-adsense,Advertising,06.01.2006,"The Google AdSense API is ideal for developers whose users create their own content through blogging, web publishing, forum/wiki/community creation, or any other application where substantial web content is generated.

Using the AdSense API, developers can let users sign up for AdSense through their site or program, generate detailed performance reports for users, and choose how the AdSense revenue is shared with our revenue sharing program. Additionally users can create accounts to store publisher website information, then generate ad code snippets and filter out unwanted ads.

A previous SOAP version has been deprecated in favor of REST with responses formatted as JSON."
17,GeoNames,/api/geonames,Reference,01.12.2006,"Geonames is a geographical database with web services that let users extract useful information about different places, such as weather, timezone and post codes. The GeoNames geographical database covers all countries and contains over eight million placenames that are available for download free of charge. Users can edit, correct and add new names using a wiki interface.

Geonames provides a suite of Webservices including the following categories:

Fulltext search
Place Hierarchy
Wikipedia
Postal Codes
Reverse Geocoding


The APIs use RESTful protocol and responses vary in format between XML, JSON, CSV, and TXT

While the GeoNames data is free, the data is available without costs, there is a Service Level Agreement available for premium web services."
18,Wikipedia,/api/wikipedia,Reference,09.05.2008,"The unofficial Wikipedia API. Because Wikipedia is built using MediaWiki, which in turn supports an API, Wikipedia does as well. This provides developers code-level access to the entire Wikipedia reference. The goal of this API is to provide direct, high-level access to the data contained in the MediaWiki databases. Client programs can use the API to login, get data, and post changes. The API supports thin web-based JavaScript clients, such as Navigation popups or LiveRC, end-user applications (such as vandal fighter), and can be accessed by another web site (tool server's utilities).

The API uses RESTful calls and supports a wide variety of formats including XML, JSON, PHP, YAML and others."
19,Box,/api/box,Content,03.07.2006,"Box is a modern content management platform that transforms how organizations work and collaborate to achieve results faster.

Box Platform provides content APIs to build secure content experiences in custom apps. With Box Platform, organizations can bring content management and collaboration services to their own custom apps or build custom integrations with Box."
20,Amazon EC2,/api/amazon-ec2,Cloud,08.25.2006,"The Amazon Elastic Compute Cloud (Amazon EC2) API is a web service that enables you to launch and manage Linux/UNIX and Windows server instances in Amazon's data centers. Giving users the ability to ""compute"" in the cloud, it provides users with complete control of their computing resources and lets them run on Amazon's computing environment. Amazon EC2 changes the economics of computing by allowing users to pay only for capacity that is actually used.

This is a REST-based API. The SOAP interface was deprecated on 1 December 2015.
The WSDL for each supported API version is available from the following URI: 
http://ec2.amazonaws.com/doc//AmazonEC2.wsdl"
21,Bing,/api/bing,Search,06.04.2009,"[The Bing API is now the Bing Web Search API. This profile is being maintained purely for historical and research purposes.]

The Bing API provides an experience similar to Bing.com/search by returning search results that Bing determines are relevant to a user's query. The results include Web pages and may also include images, videos, and more. Free trial keys are available here: https://azure.microsoft.com/en-us/try/cognitive-services/?api=bing-web-search-api."
22,LinkedIn,/api/linkedin,Social,12.10.2007,"LinkedIn is the world's largest business social networking hub. Launched in 2003, LinkedIn has millions of users and is implemented in over 200 countries. One purpose of the site is to allow registered users to maintain a list of contact details of people with whom they have some level of relationship, called Connections. Users can invite anyone (whether a site user or not) to become a connection.

The LinkedIn API is a RESTful platform that provides a simple, consistent representation of people, companies, jobs, and the interactions and relationships between them. Our query language lets you read data in XML and JSON at the granularity and aggregation that you choose. Use OAuth 1.0a to authorize users and begin making REST API calls using any programming language.The API’s access is restricted to authorized developers."
23,Instagram Graph,/api/instagram-graph,Photos,12.15.2010,"Instagram is a photo sharing iPhone app and service. Users take photos and can share them with Instagram contacts, as well as friends on other social networks like Twitter and Facebook. The Instagram API provides access to user authentication, friend connections, photos and all the other elements of the iPhone app--including uploading new media."
24,Yahoo BOSS,/api/yahoo-boss,Search,07.10.2008,"Per provider, this API will be shutting down on March 31, 2016

BOSS (Build your Own Search Service) is Yahoo!'s open search web services platform. The goal of BOSS is simple: open up Yahoo!'s search infrastructure and enable third parties to build revolutionary search products leveraging their own data, content, technology, social graph, or other assets. Developers, start-ups, and large Internet companies can use BOSS to build and launch web-scale search products that utilize the entire Yahoo! Search index. BOSS gives you access to Yahoo!'s investments in crawling and indexing, ranking and relevancy algorithms, and powerful infrastructure. By combining your assets and ideas with our search technology assets, BOSS is a platform for the next generation of search innovation. The API uses a RESTful interface and responses are formatted in XML and JSON."
25,Yelp Fusion,/api/yelp-fusion,Recommendations,08.03.2007,"The Yelp Fusion APIs are RESTful APIs and users can retrieve business review and rating, information for a particular geographic region or location.display review information for a particular business, determine accurate neighborhood name information for a particular location, track recent reviews for a particular business, display pictures of highly rated local businesses and of the top reviewers for that business, determine a particular business' review and rating information based on the phone number for that business. The default output is JSON. This output format was chosen due to the availability of JSON parsers in many languages. The following Yelp Fusion APIs are available: Search, Phone Number Search, Business Search, Transaction, Reviews, and Autcomplete - each API has a separate ProgrammableWeb entry."
26,Shopping.com,/api/shoppingcom,eCommerce,01.30.2006,"[This API has been acquired by eBay and now exists as eBay Commerce Network. This profile is being maintained purely for historical and research purposes.]

With the Shopping.com API you can integrate relevant product content with the deepest product catalog available online. Add millions of unique products and merchant offers to your site. Shopping.com, an eBay company, is the world's online comparison shopping service leader. Its global websites (Shopping.com, DealTime, and DoorOne) carry one of the world's largest product catalogs and offers from more than 6000 merchants.

The Shopping.com XML API uses a RESTful interface and can be used to feature dynamic Shopping.com content on your web pages. It offers capabilities such as keyword search, refining and sorting search results, finding product reviews, reading product specs, comparing products and prices from different merchants and controlling the number of results and navigating between pages."
27,A State of Trance,/api/state-trance,Music,11.11.2013,"A State of Trance is a radio show, hosted by Armin van Buuren, which plays trance and progressive rock music. The A State of Trance API allows developers to access information from the radio show and the Unofficial A State of Trance Android app. This includes episodes, tracks, artists, DJs, sets, labels, events, and Top 10s. This API is provided for free, though donations are appreciated."
28,Google Analytics Managment,/api/google-analytics-managment,Analytics,04.21.2009,"Use the Google Analytics Management API to leverage Google's extensive website analytics tools. The API uses GET requests over HTTPS and JSON for requests/returns. Some of the functions available with the API are: List Account, Property and View (Profile) information for a user; manage properties and goals; manage user permissions; and upload cost data to Google Analytics for non-Google paid campaigns. See the extensive documentation for code samples, detailed method descriptions, and more."
29,Yahoo Local Search,/api/yahoo-local-search,Search,11.12.2005,"The Yahoo! Local Search APIs give users access to a comprehensive database of information and content in Yahoo! Local ranging from business information to user comments to ratings. Data includes business address and phone, category, rating, distance, URL and traffic alerts. Yahoo! Local makes a great addition to any mashup, bringing in location-based relevancy and the additional context of what real people have experienced in these places.

Version 3 of Yahoo! Local Search adds even more features! Users can now request individual business records by using the Yahoo! Local listing id. Yahoo! supports search categories to help users narrow their queries. Finally, results now return the first few lines of the last user review for each listing. The API uses a RESTful protocol and responses are formatted in either XML, JSON and PHP."
30,Panoramio,/api/panoramio,Photos,06.12.2007,"(Deprecated in November, 2016) Using Panoramio API users can display the photos from Panoramio on their own web site. Geolocated photos from Panoramio can enrich maps or illustrate information where location is a important factor (real estate sites, hotels and vacation sites, routes & trails).

Panoramio is a website that enables digital photographers to geolocate, store and organize their photographsï¿½and to view those photographs in Google Earth and Google Maps. Panoramio is a community-powered site for exploring places through photography: cities, natural wonders, or anywhere you might go. Panoramio is different from other photo sharing sites because the photos illustrate places. As you browse Panoramio, notice that there aren't many photos of friends and family posing in front of places, or photos of interesting surfaces--Panoramio's all about seeing the world.

The Panoramio API uses a RESTful interface and responses are formatted in JSON."
31,Facebook Graph,/api/facebook-graph,Social,12.17.2010,"From documentation: At Facebook's core is the social graph; people and the connections they have to everything they care about. The Graph API presents a simple, consistent view of the Facebook social graph, uniformly representing objects in the graph (e.g., people, photos, events, and pages) and the connections between them (e.g., friend relationships, shared content, and photo tags).  Public information can be accessed without a developer key/application key, but is required for private data access.

The Facebook Graph API has undergone numerous versioning updates. Launched in November 2017 and scheduled to last until at least November 2019, the newly integrated features of version 2.11 include: updates to the pages API allowing users to know what is happening to private replies, posts an commenting. Updates to group/videos permissions requiring a user access token to read videos from a group, sunsetting of app links host. All these changes are accessible in the documentation of the API."
32,Salesforce,/api/salesforce,Enterprise,11.09.2005,"Unfortunately, ProgrammableWeb no longer maintains a record of this API. Usually this happens when the API provider notifies us that the API has been discontinued. The good news is we remember what categories it belonged to! Browse one of the related category or try searching for a new API."
33,Google Earth,/api/google-earth,Mapping,06.01.2008,The Google Earth Engine API allows developers to run algorithms on georeferenced imagery and vectors stored on Google's infrastructure. The Google Earth Engine API provides a library of functions which may be applied to imagery for display and analysis. Earth Engine's public data catalog contains a large amount of publicly available imagery.
34,indeed,/api/indeed,Jobs,09.04.2005,"Indeed is a search engine for jobs - with a radically different approach to job search. In one simple search, Indeed gives job seekers free access to millions of employment opportunities from thousands of websites. Indeed.com includes all the job listings from major job boards, newspapers, associations and company career pages - and we continue to add new sites every day.The Indeed API allows developers to integrate Indeed’s employer interface or job seeker interface in apps. The API returns responses in JSON or XML format."
35,Eventful,/api/eventful,Events,10.31.2005,"Eventful is the world's largest collection of events, taking place in local markets throughout the world, from concerts and sports to singles events and political rallies. Eventful.com is built upon a unique, open platform that enables partners and web applications to leverage Eventful's data, features and functionality via the Eventful API. The Eventful API provides access to the entire site database enabling developers to integrate it and the functionality of the Eventful platform into web applications. Common API tasks include event and venue search. The API uses RESTful calls and responses are formatted in either XML, JSON or YAML."
